{
  "title": "SIR/SEIR Epidemiology: Interventions, R\u2080 Estimation, and Uncertainty Ribbons",
  "domain": [
    "biology",
    "epidemiology"
  ],
  "math_core": [
    "ODE",
    "probability"
  ],
  "computational_tools": [
    "NumPy",
    "SciPy",
    "Pandas",
    "Matplotlib",
    "PyYAML",
    "PyArrow"
  ],
  "visualization_types": [
    "time_series",
    "phase_portrait",
    "stacked_area"
  ],
  "portfolio_links": [
    "deterministic ODE solvers (solve_ivp)",
    "Monte Carlo uncertainty propagation"
  ],
  "tags": [
    "SIR",
    "SEIR",
    "Rt",
    "R0",
    "interventions",
    "compartmental models"
  ],
  "stage": "runnable",
  "created": "2025-10-05T23:01:36+00:00"
}
