{
  "title": "Central Limit Sandbox: Visualizing Convergence of Standardized Sums",
  "domain": [
    "mathematics",
    "statistics"
  ],
  "math_core": [
    "probability"
  ],
  "computational_tools": [
    "NumPy",
    "SciPy",
    "Pandas",
    "Matplotlib",
    "PyYAML",
    "PyArrow"
  ],
  "visualization_types": [
    "histogram with PDF overlay",
    "Q\u2013Q plot",
    "convergence curve (KS distance)"
  ],
  "portfolio_links": [],
  "stage": "scaffolded",
  "created": "2025-10-05T23:01:36+00:00"
}
